{
  "schema_version": 1,
  "release_id": "2026-07-17.1",
  "created_at": "2026-07-17T16:05:00Z",
  "compatibility": {
    "schema_version": 1,
    "data_contract": 1,
    "identity_contract": 1,
    "artifact_contract": 1,
    "supported_migrations": {
      "minimum": "watershed.0001_initial",
      "maximum": "watershed.0006_watershed_utility_metadata"
    },
    "materializer": {
      "image_digest": "sha256:2222222222222222222222222222222222222222222222222222222222222222",
      "git_commit": "3333333333333333333333333333333333333333"
    },
    "toolchain": {
      "postgres": "16.3",
      "postgis": "3.4.2",
      "gdal": "3.8.5"
    }
  },
  "collections": [
    {
      "collection_key": "example-collection",
      "display_name": "Illustrative Collection",
      "source": {
        "kind": "batch",
        "source_revision": "illustrative-2026-07-17",
        "authentication": {
          "secret_ref": "EXAMPLE_RELEASE_TOKEN"
        }
      },
      "member_index": {
        "uri": "https://artifacts.example.test/releases/2026-07-17.1/example-collection.json",
        "sha256": "3030303030303030303030303030303030303030303030303030303030303030",
        "bytes": 4096,
        "media_type": "application/json",
        "verified": true
      },
      "expected_member_count": 2,
      "watershed_keys": ["example-north", "example-south"]
    }
  ],
  "expected_removals": [
    {
      "watershed_key": "retired-example",
      "reason": "Illustrative exact removal proving wildcard-free syntax.",
      "aliases": ["legacy/retired-example"]
    }
  ],
  "lineage": [
    {
      "event_key": "retire-old-example",
      "kind": "removal",
      "predecessors": ["retired-example"],
      "successors": [],
      "reviewed": true
    }
  ],
  "validation_report": {
    "uri": "https://artifacts.example.test/releases/2026-07-17.1/validation.json",
    "sha256": "3131313131313131313131313131313131313131313131313131313131313131",
    "bytes": 1024,
    "media_type": "application/json",
    "verified": true
  }
}
