{"collections":[{"collection_key":"gate-creek","display_name":"Gate Creek","expected_member_count":1,"member_index":{"bytes":2569,"media_type":"application/json","sha256":"821adac19c3020ed3f7a88468802a3caacb33e53d92b8bdf377024bcfa95c676","uri":"https://firewisewatersheds.org/artifacts/v1/production/objects/sha256/82/821adac19c3020ed3f7a88468802a3caacb33e53d92b8bdf377024bcfa95c676","verified":true},"source":{"kind":"standalone","source_revision":"weppcloud-20260718"},"watershed_keys":["gate-creek"]},{"collection_key":"victoria-ca","display_name":"Victoria, BC","expected_member_count":31,"member_index":{"bytes":75193,"media_type":"application/json","sha256":"194af688a24c043fb3f04cfbe5b6b85bd00a40b40f6b5d4a28c8f02104ffe398","uri":"https://firewisewatersheds.org/artifacts/v1/production/objects/sha256/19/194af688a24c043fb3f04cfbe5b6b85bd00a40b40f6b5d4a28c8f02104ffe398","verified":true},"source":{"kind":"batch","source_revision":"public-api-2e5a58909a0c-20260718"},"watershed_keys":["victoria-ca-council","victoria-ca-deception","victoria-ca-goldstream","victoria-ca-leech","victoria-ca-sooke01","victoria-ca-sooke02","victoria-ca-sooke03","victoria-ca-sooke04","victoria-ca-sooke06","victoria-ca-sooke07","victoria-ca-sooke08","victoria-ca-sooke09","victoria-ca-sooke10","victoria-ca-sooke11","victoria-ca-sooke12","victoria-ca-sooke13","victoria-ca-sooke14","victoria-ca-sooke15","victoria-ca-sooke16","victoria-ca-sooke17","victoria-ca-sooke18","victoria-ca-sooke19","victoria-ca-sooke20","victoria-ca-sooke21","victoria-ca-sooke22","victoria-ca-sooke23","victoria-ca-sooke24","victoria-ca-sooke25","victoria-ca-sooke26","victoria-ca-sooke27","victoria-ca-sooke28"]},{"collection_key":"mill-creek","display_name":"Mill Creek","expected_member_count":1,"member_index":{"bytes":2591,"media_type":"application/json","sha256":"6ac0d4dbc174b86666c6fe6fd570eff0a4811ddd804b66eecc2f4bc64aa65dfd","uri":"https://firewisewatersheds.org/artifacts/v1/production/objects/sha256/6a/6ac0d4dbc174b86666c6fe6fd570eff0a4811ddd804b66eecc2f4bc64aa65dfd","verified":true},"source":{"kind":"standalone","source_revision":"weppcloud-20260718"},"watershed_keys":["mill-creek"]},{"collection_key":"nasa-roses","display_name":"NASA ROSES 2026","expected_member_count":93,"member_index":{"bytes":261995,"media_type":"application/json","sha256":"24bc8968a24684be8fb01ab2b20a2d6654a37e45c5fb80235a2b4adfc098fb5b","uri":"https://firewisewatersheds.org/artifacts/v1/production/objects/sha256/24/24bc8968a24684be8fb01ab2b20a2d6654a37e45c5fb80235a2b4adfc098fb5b","verified":true},"source":{"authentication":{"secret_ref":"WEPPCLOUD_JWT_TOKEN"},"kind":"batch","source_revision":"wepp1-20260718-54bb501394832ca2"},"watershed_keys":["nasa-roses-or-154","nasa-roses-or-20","nasa-roses-or-194","nasa-roses-or-wa-99","nasa-roses-or-wa-100","nasa-roses-or-wa-101","nasa-roses-or-wa-102","nasa-roses-or-wa-103","nasa-roses-wa-174","nasa-roses-or-204","nasa-roses-or-202","nasa-roses-or-6","nasa-roses-or-9","nasa-roses-or-12","nasa-roses-or-93","nasa-roses-wa-25","nasa-roses-or-16","nasa-roses-or-13","nasa-roses-or-41","nasa-roses-or-5","nasa-roses-or-184","nasa-roses-or-17","nasa-roses-or-21","nasa-roses-or-33","nasa-roses-or-45","nasa-roses-or-207","nasa-roses-or-30","nasa-roses-or-206","nasa-roses-or-11","nasa-roses-or-22","nasa-roses-or-23","nasa-roses-wa-9","nasa-roses-wa-10","nasa-roses-wa-79","nasa-roses-wa-80","nasa-roses-wa-81","nasa-roses-wa-26","nasa-roses-wa-106","nasa-roses-wa-77","nasa-roses-wa-78","nasa-roses-or-24","nasa-roses-or-44","nasa-roses-or-108","nasa-roses-or-125","nasa-roses-or-18","nasa-roses-or-40","nasa-roses-or-51","nasa-roses-or-205","nasa-roses-or-27","nasa-roses-or-39","nasa-roses-or-138","nasa-roses-or-149","nasa-roses-or-151","nasa-roses-or-164","nasa-roses-or-165","nasa-roses-or-168","nasa-roses-or-123","nasa-roses-or-141","nasa-roses-or-167","nasa-roses-or-14","nasa-roses-or-47","nasa-roses-or-8","nasa-roses-or-191","nasa-roses-or-19","nasa-roses-or-60","nasa-roses-or-188","nasa-roses-or-28","nasa-roses-or-26","nasa-roses-or-126","nasa-roses-or-195","nasa-roses-or-25","nasa-roses-or-48","nasa-roses-or-185","nasa-roses-or-7","nasa-roses-or-10","nasa-roses-or-15","nasa-roses-or-160","nasa-roses-wa-36","nasa-roses-wa-37","nasa-roses-wa-38","nasa-roses-wa-39","nasa-roses-wa-82","nasa-roses-wa-57","nasa-roses-wa-30","nasa-roses-wa-117","nasa-roses-wa-141","nasa-roses-wa-18","nasa-roses-wa-19","nasa-roses-wa-50","nasa-roses-wa-155","nasa-roses-wa-156","nasa-roses-wa-162","nasa-roses-wa-163"]},{"collection_key":"bremerton","display_name":"Bremerton","expected_member_count":3,"member_index":{"bytes":7491,"media_type":"application/json","sha256":"3b5b1abe859f34e10482ae02490778944e2b99f55c0439fc67cc5316d6a70dba","uri":"https://firewisewatersheds.org/artifacts/v1/production/objects/sha256/3b/3b5b1abe859f34e10482ae02490778944e2b99f55c0439fc67cc5316d6a70dba","verified":true},"source":{"authentication":{"secret_ref":"WEPPCLOUD_JWT_TOKEN"},"kind":"batch","source_revision":"wepp1-20260718-fb4197530ebc317e"},"watershed_keys":["bremerton-01","bremerton-02","bremerton-03"]}],"compatibility":{"artifact_contract":1,"data_contract":1,"identity_contract":1,"materializer":{"git_commit":"22647350b9163587485239af1c28e5430937af49","image_digest":"sha256:301f91b2a6bba1ead732830e542a51ce5f4fddaae2e862046c38a134fcc5747b"},"schema_version":1,"supported_migrations":{"maximum":"watershed.0011_capability_runtime_types","minimum":"watershed.0011_capability_runtime_types"},"toolchain":{"gdal":"3.12.0","postgis":"3.5.2","postgres":"17.5"}},"created_at":"2026-07-19T19:35:46Z","expected_removals":[],"lineage":[],"release_id":"2026-07-19.31","schema_version":1,"validation_report":{"bytes":1242,"media_type":"application/json","sha256":"a3463d0be077dace0a8572785b9dfcff645cce9feb45f1af3fb0b6793528deca","uri":"https://firewisewatersheds.org/artifacts/v1/production/objects/sha256/a3/a3463d0be077dace0a8572785b9dfcff645cce9feb45f1af3fb0b6793528deca","verified":true}}
